1007,70807755,Boys and Girls Club of East Scarb. [Child care] - West Rouge Kindergarten Extended Care Program,NA,NA,NA,NA,NA,NA,NA,NA,NA,NA,NA,NA,NA,NA,NA,NA,NA,NA,NA,NA,NA,NA,NA,NA,NA
1008,70807752,Boys and Girls Club of East Scarb. [Child care] - William G Davis Kindergarten Extended Care Program,NA,NA,NA,NA,NA,NA,NA,NA,NA,NA,NA,NA,NA,NA,NA,NA,NA,NA,NA,NA,NA,NA,NA,NA,NA
1009,71085786,Bradgate Arms Retirement Residence - Bradgate Arms Retirement Residence,Revera Retirement,NA,NA,NA,NA,NA,NA,NA,NA,NA,NA,NA,NA,NA,NA,NA,NA,NA,NA,NA,NA,NA,NA,NA,NA
1010,70807694,"Braeburn Neighbourhood Place, Braeburn Woods Day Care Centre - Braeburn Neighbourhood Place, Braeburn Woods Day Care Centre",NA,NA,NA,NA,NA,NA,NA,NA,NA,NA,NA,NA,NA,NA,NA,NA,NA,NA,NA,NA,NA,NA,NA,NA,NA
1011,70809847,Brahms Early Learning and Child Care Centre - Brahms Early Learning and Child Care Centre,NA,NA,NA,NA,NA,NA,NA,NA,NA,NA,NA,NA,NA,NA,NA,NA,NA,NA,NA,NA,NA,NA,NA,NA,NA
1012,72721699,Brain Injury Society of TO (BIST) - Brain Injury Society of TO (BIST),BIST,Brain Injury Society,Toronto Brain Injury Society,NA,NA,NA,NA,NA,NA,NA,NA,NA,NA,NA,NA,NA,NA,NA,NA,NA,NA,NA,NA,NA,NA
1013,69798939,Brands for Canada - Brands for Canada,United Hearts Campaign,NA,NA,NA,NA,NA,NA,NA,NA,NA,NA,NA,NA,NA,NA,NA,NA,NA,NA,NA,NA,NA,NA,NA,NA
1014,70810316,Branson Pre-School - Branson Pre-School,NA,NA,NA,NA,NA,NA,NA,NA,NA,NA,NA,NA,NA,NA,NA,NA,NA,NA,NA,NA,NA,NA,NA,NA,NA
1015,70810468,Brian Petits Amis - Brian Petits Amis,NA,NA,NA,NA,NA,NA,NA,NA,NA,NA,NA,NA,NA,NA,NA,NA,NA,NA,NA,NA,NA,NA,NA,NA,NA
1016,70810476,Briarcrest Child Care - Briarcrest Child Care,NA,NA,NA,NA,NA,NA,NA,NA,NA,NA,NA,NA,NA,NA,NA,NA,NA,NA,NA,NA,NA,NA,NA,NA,NA
1017,70810855,Bridlegrove Daycare Centre - Bridlegrove Daycare Centre,NA,NA,NA,NA,NA,NA,NA,NA,NA,NA,NA,NA,NA,NA,NA,NA,NA,NA,NA,NA,NA,NA,NA,NA,NA
1018,70808130,Bright Minds Childcare and Montessori School - Bright Minds Childcare and Montessori School,NA,NA,NA,NA,NA,NA,NA,NA,NA,NA,NA,NA,NA,NA,NA,NA,NA,NA,NA,NA,NA,NA,NA,NA,NA
1019,70917104,Brightpath Academy Forest Hill - Brightpath Academy Forest Hill,NA,NA,NA,NA,NA,NA,NA,NA,NA,NA,NA,NA,NA,NA,NA,NA,NA,NA,NA,NA,NA,NA,NA,NA,NA
1020,70808557,Brightpath Eglinton - Brightpath Eglinton,NA,NA,NA,NA,NA,NA,NA,NA,NA,NA,NA,NA,NA,NA,NA,NA,NA,NA,NA,NA,NA,NA,NA,NA,NA
1021,67795900,British Consulate General - Emergency Travel Documents,British High Commission,NA,NA,NA,NA,NA,NA,NA,NA,NA,NA,NA,NA,NA,NA,NA,NA,NA,NA,NA,NA,NA,NA,NA,NA
1022,70807606,Broad View French Montessori School - Broad View French Montessori School,NA,NA,NA,NA,NA,NA,NA,NA,NA,NA,NA,NA,NA,NA,NA,NA,NA,NA,NA,NA,NA,NA,NA,NA,NA
1023,70811337,Broad View French Montessori School - Broad View French Montessori School,NA,NA,NA,NA,NA,NA,NA,NA,NA,NA,NA,NA,NA,NA,NA,NA,NA,NA,NA,NA,NA,NA,NA,NA,NA
1024,70808275,Brock Early Learning Centre - Brock Early Learning Centre,NA,NA,NA,NA,NA,NA,NA,NA,NA,NA,NA,NA,NA,NA,NA,NA,NA,NA,NA,NA,NA,NA,NA,NA,NA
1025,70808814,"Brookhaven Child Care - Brookhaven Child Care, Brookhaven Public School",NA,NA,NA,NA,NA,NA,NA,NA,NA,NA,NA,NA,NA,NA,NA,NA,NA,NA,NA,NA,NA,NA,NA,NA,NA
1026,70808811,"Brookhaven Child Care - Brookhaven Child Care, St Bernard Site",NA,NA,NA,NA,NA,NA,NA,NA,NA,NA,NA,NA,NA,NA,NA,NA,NA,NA,NA,NA,NA,NA,NA,NA,NA
1027,70808970,Buchanan Extended Day and School Age Program - Buchanan Extended Day and School Age Program,NA,NA,NA,NA,NA,NA,NA,NA,NA,NA,NA,NA,NA,NA,NA,NA,NA,NA,NA,NA,NA,NA,NA,NA,NA
1028,72404529,Buddy Services for Seniors - Buddy Services for Seniors,NA,NA,NA,NA,NA,NA,NA,NA,NA,NA,NA,NA,NA,NA,NA,NA,NA,NA,NA,NA,NA,NA,NA,NA,NA
1029,70917100,Buds And Blossoms - Buds And Blossoms,NA,NA,NA,NA,NA,NA,NA,NA,NA,NA,NA,NA,NA,NA,NA,NA,NA,NA,NA,NA,NA,NA,NA,NA,NA
1030,70808986,Bumble Bee Academy - Bumble Bee Academy,NA,NA,NA,NA,NA,NA,NA,NA,NA,NA,NA,NA,NA,NA,NA,NA,NA,NA,NA,NA,NA,NA,NA,NA,NA
1031,72403894,Cabbagetown Women's Clinic - Cabbagetown Women's Clinic,Cabbagetown Abortion Clinic,Womens Clinic,NA,NA,NA,NA,NA,NA,NA,NA,NA,NA,NA,NA,NA,NA,NA,NA,NA,NA,NA,NA,NA,NA,NA
1032,70809036,Calico Saints Child Care Centre - Calico Saints Child Care Centre,NA,NA,NA,NA,NA,NA,NA,NA,NA,NA,NA,NA,NA,NA,NA,NA,NA,NA,NA,NA,NA,NA,NA,NA,NA
1033,70917096,Cambridge Leaf Montessori School - Cambridge Leaf Montessori School,NA,NA,NA,NA,NA,NA,NA,NA,NA,NA,NA,NA,NA,NA,NA,NA,NA,NA,NA,NA,NA,NA,NA,NA,NA
1034,70809239,Cambridge Place Centre For Early Learning - Cambridge Place Centre For Early Learning,NA,NA,NA,NA,NA,NA,NA,NA,NA,NA,NA,NA,NA,NA,NA,NA,NA,NA,NA,NA,NA,NA,NA,NA,NA
1035,71085722,Camp Oochigeas - Camp Oochigeas,NA,NA,NA,NA,NA,NA,NA,NA,NA,NA,NA,NA,NA,NA,NA,NA,NA,NA,NA,NA,NA,NA,NA,NA,NA
1036,71893205,Camp Quality Canada - Therapeutic Camp for Children with Cancer,Breaking Borders,CQ Southern Ontario,New Heights,NA,NA,NA,NA,NA,NA,NA,NA,NA,NA,NA,NA,NA,NA,NA,NA,NA,NA,NA,NA,NA,NA
1037,70808290,Campus Community Co-Operative Day Care - Campus Community Co-Operative Day Care,NA,NA,NA,NA,NA,NA,NA,NA,NA,NA,NA,NA,NA,NA,NA,NA,NA,NA,NA,NA,NA,NA,NA,NA,NA
1038,69041652,"Canada Mortgage and Housing Corporation [TO area], ON Business Centre - Affordable Housing - Indigenous and the North Housing Solutions",CMHC / SCHL;,NA,NA,NA,NA,NA,NA,NA,NA,NA,NA,NA,NA,NA,NA,NA,NA,NA,NA,NA,NA,NA,NA,NA,NA
1039,68977375,Canada. Canada Revenue Agency - Informant Leads Program,CRA Snitch Line,CV19,National Leads Centre,OCR,NA,NA,NA,NA,NA,NA,NA,NA,NA,NA,NA,NA,NA,NA,NA,NA,NA,NA,NA,NA,NA
1040,68977971,Canada. Health Canada - Medical Devices Hotline,Healthy Canadians;,NA,NA,NA,NA,NA,NA,NA,NA,NA,NA,NA,NA,NA,NA,NA,NA,NA,NA,NA,NA,NA,NA,NA,NA
1041,65271202,Canada. Indigenous Services Canada - Northern ON - First Nations and Inuit Skills Link Program,FNIYES,ISC,TBY,NA,NA,NA,NA,NA,NA,NA,NA,NA,NA,NA,NA,NA,NA,NA,NA,NA,NA,NA,NA,NA,NA
1042,68956334,Canadian Abilities Foundation - Canadian Abilities Foundation,Access Guide Canada,CAF,NA,NA,NA,NA,NA,NA,NA,NA,NA,NA,NA,NA,NA,NA,NA,NA,NA,NA,NA,NA,NA,NA,NA
1043,71083832,Canadian Addison Society (The) - Canadian Addison Society (The),Société Canadienne d'Addison (La),NA,NA,NA,NA,NA,NA,NA,NA,NA,NA,NA,NA,NA,NA,NA,NA,NA,NA,NA,NA,NA,NA,NA,NA
1044,72721227,Canadian Alliance of Physiotherapy Regulators (The) - Canadian Alliance of Physiotherapy Regulators (The),NA,NA,NA,NA,NA,NA,NA,NA,NA,NA,NA,NA,NA,NA,NA,NA,NA,NA,NA,NA,NA,NA,NA,NA,NA
1045,67330954,Canadian Baptists of ON and Quebec - Canadian Baptists of ON and Quebec,NA,NA,NA,NA,NA,NA,NA,NA,NA,NA,NA,NA,NA,NA,NA,NA,NA,NA,NA,NA,NA,NA,NA,NA,NA
1046,71085840,Canadian Cancer Society - Cancer Information and Support Services,Cancer Connection,Cancer Hotline,Cancer Information Service,Cancer Society,Ontario Tobacco-Free Network,Smokers Helpline,Smokers' Helpline,NA,NA,NA,NA,NA,NA,NA,NA,NA,NA,NA,NA,NA,NA,NA,NA,NA,NA
1047,70444723,Canadian Cancer Society - Cancer Information Service,CV19,Service d'information sur le cancer,Société canadienne du cancer,NA,NA,NA,NA,NA,NA,NA,NA,NA,NA,NA,NA,NA,NA,NA,NA,NA,NA,NA,NA,NA,NA
1048,71454749,Canadian Cancer Society - ON Division - Breast Cancer Support and Information Team,Canadian Breast Cancer Foundation,CCS,SCC,SIC (CIS),Société canadienne du cancer,NA,NA,NA,NA,NA,NA,NA,NA,NA,NA,NA,NA,NA,NA,NA,NA,NA,NA,NA,NA
1049,71454746,Canadian Cancer Society - ON Division - Canadian Cancer Society - ON Division,Canadian Breast Cancer Foundation,CCS,SCC,SIC (CIS),Société canadienne du cancer,NA,NA,NA,NA,NA,NA,NA,NA,NA,NA,NA,NA,NA,NA,NA,NA,NA,NA,NA,NA
1050,71454742,Canadian Cancer Society - ON Division - Canadian Cancer Society - ON Division - Peer Match Program,CancerConnection,NA,NA,NA,NA,NA,NA,NA,NA,NA,NA,NA,NA,NA,NA,NA,NA,NA,NA,NA,NA,NA,NA,NA,NA
1051,71454740,Canadian Cancer Society - ON Division - Cancer Information Service,CIS,NA,NA,NA,NA,NA,NA,NA,NA,NA,NA,NA,NA,NA,NA,NA,NA,NA,NA,NA,NA,NA,NA,NA,NA
1052,71454744,Canadian Cancer Society - ON Division - Smokers' Helpline,SHO,NA,NA,NA,NA,NA,NA,NA,NA,NA,NA,NA,NA,NA,NA,NA,NA,NA,NA,NA,NA,NA,NA,NA,NA
1053,68981145,Canadian Cultural Society of the Deaf - Canadian Cultural Society of the Deaf,DEAF CULTURE CENTRE,NA,NA,NA,NA,NA,NA,NA,NA,NA,NA,NA,NA,NA,NA,NA,NA,NA,NA,NA,NA,NA,NA,NA,NA
1054,69800284,Canadian Feed The Children - Canadian Feed The Children,Feed the Children,Feed the Children International,NA,NA,NA,NA,NA,NA,NA,NA,NA,NA,NA,NA,NA,NA,NA,NA,NA,NA,NA,NA,NA,NA,NA
1055,73440742,Canadian Helen Keller Centre - Canadian Helen Keller Centre,CHKC,NA,NA,NA,NA,NA,NA,NA,NA,NA,NA,NA,NA,NA,NA,NA,NA,NA,NA,NA,NA,NA,NA,NA,NA
1056,73440745,Canadian Helen Keller Centre - Outreach Intervenor Services,CHKC,NA,NA,NA,NA,NA,NA,NA,NA,NA,NA,NA,NA,NA,NA,NA,NA,NA,NA,NA,NA,NA,NA,NA,NA
1057,73440732,Canadian Helen Keller Centre - Public Awareness,CHKC,NA,NA,NA,NA,NA,NA,NA,NA,NA,NA,NA,NA,NA,NA,NA,NA,NA,NA,NA,NA,NA,NA,NA,NA
1058,73440747,Canadian Helen Keller Centre - Rotary Cheshire Apartments,RCA,Rotary Cheshire Apartments,NA,NA,NA,NA,NA,NA,NA,NA,NA,NA,NA,NA,NA,NA,NA,NA,NA,NA,NA,NA,NA,NA,NA
1059,73440734,Canadian Helen Keller Centre - Seniors Services,Canadian Helen Keller Organization,NA,NA,NA,NA,NA,NA,NA,NA,NA,NA,NA,NA,NA,NA,NA,NA,NA,NA,NA,NA,NA,NA,NA,NA
1060,73440736,Canadian Helen Keller Centre - Skills of Daily Living,CHKC,NA,NA,NA,NA,NA,NA,NA,NA,NA,NA,NA,NA,NA,NA,NA,NA,NA,NA,NA,NA,NA,NA,NA,NA
1061,73440740,Canadian Helen Keller Centre - Training Centre and Seniors Program,CHKC,NA,NA,NA,NA,NA,NA,NA,NA,NA,NA,NA,NA,NA,NA,NA,NA,NA,NA,NA,NA,NA,NA,NA,NA
1062,73440738,Canadian Helen Keller Centre - Workshop Style Instruction,CHKC,NA,NA,NA,NA,NA,NA,NA,NA,NA,NA,NA,NA,NA,NA,NA,NA,NA,NA,NA,NA,NA,NA,NA,NA
1063,71584591,Canadian Hemophilia Society - Blood Disorders Information and Support,NA,NA,NA,NA,NA,NA,NA,NA,NA,NA,NA,NA,NA,NA,NA,NA,NA,NA,NA,NA,NA,NA,NA,NA,NA
1064,71265877,Canadian HIV / AIDS Legal Network - Canadian HIV / AIDS Legal Network,NA,NA,NA,NA,NA,NA,NA,NA,NA,NA,NA,NA,NA,NA,NA,NA,NA,NA,NA,NA,NA,NA,NA,NA,NA
1065,69794513,Canadian Labour Congress - ON Regional Office,CLC,WorkRights.ca,NA,NA,NA,NA,NA,NA,NA,NA,NA,NA,NA,NA,NA,NA,NA,NA,NA,NA,NA,NA,NA,NA,NA
1066,69794479,Canadian Marketing Association - Canadian Marketing Association,CMA,Do Not Contact Service,Do Not Mail Service,Operation Integrity,NA,NA,NA,NA,NA,NA,NA,NA,NA,NA,NA,NA,NA,NA,NA,NA,NA,NA,NA,NA,NA
1067,71084105,Canadian Organization for Rare Disorders - Canadian Organization for Rare Disorders,CORD,OCMR,Organisation canadienne des maladies rares,NA,NA,NA,NA,NA,NA,NA,NA,NA,NA,NA,NA,NA,NA,NA,NA,NA,NA,NA,NA,NA,NA
1068,69794556,"Canadian Red Cross, TO Branch - Canadian Red Cross, TO Branch",CV19,NA,NA,NA,NA,NA,NA,NA,NA,NA,NA,NA,NA,NA,NA,NA,NA,NA,NA,NA,NA,NA,NA,NA,NA
1069,72834799,"Canadian Red Cross, TO Branch - Mobile food bank",CBX2,CV19,NA,NA,NA,NA,NA,NA,NA,NA,NA,NA,NA,NA,NA,NA,NA,NA,NA,NA,NA,NA,NA,NA,NA
1070,67340625,Canadian Roots Exchange - Canadian Roots Exchange,CRE,NA,NA,NA,NA,NA,NA,NA,NA,NA,NA,NA,NA,NA,NA,NA,NA,NA,NA,NA,NA,NA,NA,NA,NA
1071,69829142,Canadian Safe Boating Council - STARTBoating,CSBC,Start Boating,NA,NA,NA,NA,NA,NA,NA,NA,NA,NA,NA,NA,NA,NA,NA,NA,NA,NA,NA,NA,NA,NA,NA
1072,69619706,Canadian Spondylitis Association - Canadian Spondylitis Association,NA,NA,NA,NA,NA,NA,NA,NA,NA,NA,NA,NA,NA,NA,NA,NA,NA,NA,NA,NA,NA,NA,NA,NA,NA
1073,69797920,Canadian Voice of Women for Peace - Canadian Voice of Women for Peace,Voice of Women for Peace,VOW,Women for Peace,NA,NA,NA,NA,NA,NA,NA,NA,NA,NA,NA,NA,NA,NA,NA,NA,NA,NA,NA,NA,NA,NA
1074,70809887,Canadiana Court Early Learning and Child Care Centre - Canadiana Court Early Learning and Child Care Centre,NA,NA,NA,NA,NA,NA,NA,NA,NA,NA,NA,NA,NA,NA,NA,NA,NA,NA,NA,NA,NA,NA,NA,NA,NA
1075,71096636,Cancer Care ON - ON Breast Screening Program,CCO,NA,NA,NA,NA,NA,NA,NA,NA,NA,NA,NA,NA,NA,NA,NA,NA,NA,NA,NA,NA,NA,NA,NA,NA
1076,70809785,Candy Factory Swallows Day Care (The) - Candy Factory Swallows Day Care (The),NA,NA,NA,NA,NA,NA,NA,NA,NA,NA,NA,NA,NA,NA,NA,NA,NA,NA,NA,NA,NA,NA,NA,NA,NA
1077,72399876,Canterbury Place Retirement Residence - Canterbury Place Retirement Residence,NA,NA,NA,NA,NA,NA,NA,NA,NA,NA,NA,NA,NA,NA,NA,NA,NA,NA,NA,NA,NA,NA,NA,NA,NA
1078,70807587,Cardinal Leger Child Care Centre - Cardinal Leger Child Care Centre,NA,NA,NA,NA,NA,NA,NA,NA,NA,NA,NA,NA,NA,NA,NA,NA,NA,NA,NA,NA,NA,NA,NA,NA,NA
1079,73440809,Carefree Lodge - Long-Term Care Home,NA,NA,NA,NA,NA,NA,NA,NA,NA,NA,NA,NA,NA,NA,NA,NA,NA,NA,NA,NA,NA,NA,NA,NA,NA
1080,70807710,Carefree Preschool - Carefree Preschool,NA,NA,NA,NA,NA,NA,NA,NA,NA,NA,NA,NA,NA,NA,NA,NA,NA,NA,NA,NA,NA,NA,NA,NA,NA
1081,71085816,CarePartners - Home Health Services,NA,NA,NA,NA,NA,NA,NA,NA,NA,NA,NA,NA,NA,NA,NA,NA,NA,NA,NA,NA,NA,NA,NA,NA,NA
1082,71077952,Caring Hands - Caring Hands,NA,NA,NA,NA,NA,NA,NA,NA,NA,NA,NA,NA,NA,NA,NA,NA,NA,NA,NA,NA,NA,NA,NA,NA,NA
1083,70808294,Carmelite Day Nursery - Carmelite Day Nursery,NA,NA,NA,NA,NA,NA,NA,NA,NA,NA,NA,NA,NA,NA,NA,NA,NA,NA,NA,NA,NA,NA,NA,NA,NA
1084,70808297,"Carmelite Day Nursery - Carmelite Day Nursery, Pope Francis",NA,NA,NA,NA,NA,NA,NA,NA,NA,NA,NA,NA,NA,NA,NA,NA,NA,NA,NA,NA,NA,NA,NA,NA,NA
1085,70810835,Carmelite Missionary Sisters of St Theresa Of Child Jesus - Carmelite Missionary Sisters Of St Theresa Of Child Jesus,NA,NA,NA,NA,NA,NA,NA,NA,NA,NA,NA,NA,NA,NA,NA,NA,NA,NA,NA,NA,NA,NA,NA,NA,NA
1086,70811180,Carousel Child Care Development Centre - Carousel Child Care Development Centre,NA,NA,NA,NA,NA,NA,NA,NA,NA,NA,NA,NA,NA,NA,NA,NA,NA,NA,NA,NA,NA,NA,NA,NA,NA
1087,70807682,Casa Vera Montessori School - Casa Vera Montessori School,NA,NA,NA,NA,NA,NA,NA,NA,NA,NA,NA,NA,NA,NA,NA,NA,NA,NA,NA,NA,NA,NA,NA,NA,NA
1088,72403523,Casey House - Casey House,Home Hospice Program,HT1,NA,NA,NA,NA,NA,NA,NA,NA,NA,NA,NA,NA,NA,NA,NA,NA,NA,NA,NA,NA,NA,NA,NA
1089,70807670,CASP Catholic After School Program - CASP Catholic After School Program,NA,NA,NA,NA,NA,NA,NA,NA,NA,NA,NA,NA,NA,NA,NA,NA,NA,NA,NA,NA,NA,NA,NA,NA,NA
1090,72400022,Cassandra Medical Clinic - Cassandra Medical Clinic,NA,NA,NA,NA,NA,NA,NA,NA,NA,NA,NA,NA,NA,NA,NA,NA,NA,NA,NA,NA,NA,NA,NA,NA,NA
1091,70809204,Cast For Kids Child Care Centre - Cast For Kids Child Care Centre,NA,NA,NA,NA,NA,NA,NA,NA,NA,NA,NA,NA,NA,NA,NA,NA,NA,NA,NA,NA,NA,NA,NA,NA,NA
1092,70808513,Castle Park Playschool - Castle Park Playschool,NA,NA,NA,NA,NA,NA,NA,NA,NA,NA,NA,NA,NA,NA,NA,NA,NA,NA,NA,NA,NA,NA,NA,NA,NA
1093,73451187,Castleview Wychwood Towers - Long-Term Care Home,Homes for the Aged,Municipal Homes for the Aged,Municipal Long Term Care Facilities,Toronto Homes for the Aged,NA,NA,NA,NA,NA,NA,NA,NA,NA,NA,NA,NA,NA,NA,NA,NA,NA,NA,NA,NA,NA
1094,70916978,Caterpillar and Company - Caterpillar and Company,NA,NA,NA,NA,NA,NA,NA,NA,NA,NA,NA,NA,NA,NA,NA,NA,NA,NA,NA,NA,NA,NA,NA,NA,NA
1095,69794571,Catholic Charities of the Archdiocese of TO - Catholic Charities of the Archdiocese of TO,Share Life,ShareLife,Toronto Catholic Charities of the Archdiocese,NA,NA,NA,NA,NA,NA,NA,NA,NA,NA,NA,NA,NA,NA,NA,NA,NA,NA,NA,NA,NA,NA
1096,70808590,Catholic Settlement House Day Nursery - Catholic Settlement House Day Nursery,NA,NA,NA,NA,NA,NA,NA,NA,NA,NA,NA,NA,NA,NA,NA,NA,NA,NA,NA,NA,NA,NA,NA,NA,NA
1097,72904775,CATIE (Canadian AIDS Treatment Information Exchange) - CATIE (Canadian AIDS Treatment Information Exchange),Canadian AIDS Treatment Information Exchange,Source canadienne de renseignements sur le VIH et l'hépatite C (La),NA,NA,NA,NA,NA,NA,NA,NA,NA,NA,NA,NA,NA,NA,NA,NA,NA,NA,NA,NA,NA,NA,NA
1098,72904778,CATIE (Canadian AIDS Treatment Information Exchange) - HIV411.ca,Canadian AIDS Treatment Information Exchange,Source canadienne de renseignements sur le VIH et l'hépatite C (La),NA,NA,NA,NA,NA,NA,NA,NA,NA,NA,NA,NA,NA,NA,NA,NA,NA,NA,NA,NA,NA,NA,NA
1099,69794641,Cecil Community Centre - Cecil Community Centre,Chinese Dance Workshop,CV19,EarlyON Child and Family Centre,NA,NA,NA,NA,NA,NA,NA,NA,NA,NA,NA,NA,NA,NA,NA,NA,NA,NA,NA,NA,NA,NA
1100,70807618,Cedarbrae Day Nurseries - Cedarbrae Day Nurseries,NA,NA,NA,NA,NA,NA,NA,NA,NA,NA,NA,NA,NA,NA,NA,NA,NA,NA,NA,NA,NA,NA,NA,NA,NA
1101,70808745,Cedarbrae Day Nurseries - Cedarbrae Day Nurseries,NA,NA,NA,NA,NA,NA,NA,NA,NA,NA,NA,NA,NA,NA,NA,NA,NA,NA,NA,NA,NA,NA,NA,NA,NA
1102,70808578,Cedarbrae Infant Day Nursery - Cedarbrae Infant Day Nursery,NA,NA,NA,NA,NA,NA,NA,NA,NA,NA,NA,NA,NA,NA,NA,NA,NA,NA,NA,NA,NA,NA,NA,NA,NA
1103,71077924,Cedarbrook Lodge Retirement Residence - Cedarbrook Lodge Retirement Residence,NA,NA,NA,NA,NA,NA,NA,NA,NA,NA,NA,NA,NA,NA,NA,NA,NA,NA,NA,NA,NA,NA,NA,NA,NA
1104,70811132,Cedarvale B and A School Program - Cedarvale B and A School Program,NA,NA,NA,NA,NA,NA,NA,NA,NA,NA,NA,NA,NA,NA,NA,NA,NA,NA,NA,NA,NA,NA,NA,NA,NA
1105,73451130,Cedarvale Terrace - Long Term Care Home - Cedarvale Terrace - Long Term Care Home,NA,NA,NA,NA,NA,NA,NA,NA,NA,NA,NA,NA,NA,NA,NA,NA,NA,NA,NA,NA,NA,NA,NA,NA,NA
1106,70809891,Centenary Seven Oaks Early Learning and Child Care Centre - Centenary Seven Oaks Early Learning and Child Care Centre,NA,NA,NA,NA,NA,NA,NA,NA,NA,NA,NA,NA,NA,NA,NA,NA,NA,NA,NA,NA,NA,NA,NA,NA,NA
1107,70917606,Centennial College [Child care] - Early Childhood Education Centre - East York,NA,NA,NA,NA,NA,NA,NA,NA,NA,NA,NA,NA,NA,NA,NA,NA,NA,NA,NA,NA,NA,NA,NA,NA,NA
1108,70917603,Centennial College [Child care] - East York Day Care Centre,NA,NA,NA,NA,NA,NA,NA,NA,NA,NA,NA,NA,NA,NA,NA,NA,NA,NA,NA,NA,NA,NA,NA,NA,NA
1109,70917600,Centennial College [Child care] - Progress Campus Child Care Centre,NA,NA,NA,NA,NA,NA,NA,NA,NA,NA,NA,NA,NA,NA,NA,NA,NA,NA,NA,NA,NA,NA,NA,NA,NA
1110,70811116,"Centennial Infant And Child Centre, Preschool Program - Centennial Infant And Child Centre, Preschool Program",NA,NA,NA,NA,NA,NA,NA,NA,NA,NA,NA,NA,NA,NA,NA,NA,NA,NA,NA,NA,NA,NA,NA,NA,NA
1111,70808749,Central Eglinton Childrens' Centre - Central Eglinton Childrens' Centre,NA,NA,NA,NA,NA,NA,NA,NA,NA,NA,NA,NA,NA,NA,NA,NA,NA,NA,NA,NA,NA,NA,NA,NA,NA
1112,69794653,Central Eglinton Community Centre - Central Eglinton Community Centre,CECC,CV19,Eglinton Community Centre,NA,NA,NA,NA,NA,NA,NA,NA,NA,NA,NA,NA,NA,NA,NA,NA,NA,NA,NA,NA,NA,NA
1113,71173426,"Central Montessori Schools - Central Montessori Schools, Willowdale Campus",NA,NA,NA,NA,NA,NA,NA,NA,NA,NA,NA,NA,NA,NA,NA,NA,NA,NA,NA,NA,NA,NA,NA,NA,NA
1114,71173432,"Central Montessori Schools - Central Montessori Schools, York Mills Campus",NA,NA,NA,NA,NA,NA,NA,NA,NA,NA,NA,NA,NA,NA,NA,NA,NA,NA,NA,NA,NA,NA,NA,NA,NA
1115,71173429,Central Montessori Schools - Maplehurst Campus,NA,NA,NA,NA,NA,NA,NA,NA,NA,NA,NA,NA,NA,NA,NA,NA,NA,NA,NA,NA,NA,NA,NA,NA,NA
1116,69794659,Central Neighbourhood House - Central Neighbourhood House,Boyz 2 Men,CNH,CV19,East African Women's Circle,East African Youth Project,Easy Access Voice Mail Project,GEMS,Metro Voice Mail Project,Neighbourhood Group,Stroke Survivors Day Program,Voice Mail Project,Voluntary Trusteeship program,NA,NA,NA,NA,NA,NA,NA,NA,NA,NA,NA,NA,NA
1117,70809032,"Central Neighbourhood House, ON Day Care - Central Neighbourhood House, ON Day Care",NA,NA,NA,NA,NA,NA,NA,NA,NA,NA,NA,NA,NA,NA,NA,NA,NA,NA,NA,NA,NA,NA,NA,NA,NA
1118,70807941,"Central Neighbourhood House, Winchester Daycare Centre - Central Neighbourhood House, Winchester Daycare Centre",NA,NA,NA,NA,NA,NA,NA,NA,NA,NA,NA,NA,NA,NA,NA,NA,NA,NA,NA,NA,NA,NA,NA,NA,NA
1119,70808388,Centre De La Petite Enfance - Les Amis Du Monde - Centre De La Petite Enfance - Les Amis Du Monde,NA,NA,NA,NA,NA,NA,NA,NA,NA,NA,NA,NA,NA,NA,NA,NA,NA,NA,NA,NA,NA,NA,NA,NA,NA
1120,70808537,Centre Educatif A Petits Pas - Centre Educatif A Petits Pas,NA,NA,NA,NA,NA,NA,NA,NA,NA,NA,NA,NA,NA,NA,NA,NA,NA,NA,NA,NA,NA,NA,NA,NA,NA
1121,69800531,Centre for Addiction and Mental Health - PREGNETS.org,Centre for Addiction and Mental Health,PREGNETS,Prevention of Gestational and Neonatal Exposure to Tobacco Smoke,NA,NA,NA,NA,NA,NA,NA,NA,NA,NA,NA,NA,NA,NA,NA,NA,NA,NA,NA,NA,NA,NA
1122,73450962,Centre for Independent Living in TO - Attendant Service Application Centre (ASAC),CAR Online,CILT,Consumer Attendant Roster,Greenbook Online,PIC,NA,NA,NA,NA,NA,NA,NA,NA,NA,NA,NA,NA,NA,NA,NA,NA,NA,NA,NA,NA
1123,73450964,Centre for Independent Living in TO - Centre for Independent Living in TO,CILT,Diners Club,Direct Funding Program,Greenbook Online,Parents with a Disability Network,PIC,Project Information Centre,NA,NA,NA,NA,NA,NA,NA,NA,NA,NA,NA,NA,NA,NA,NA,NA,NA,NA
1124,69801753,Centre for Social Innovation - Centre for Social Innovation,CSI Spadina,Social Innovation Centre,Tech Soup Canada,TechSoup Canada,NA,NA,NA,NA,NA,NA,NA,NA,NA,NA,NA,NA,NA,NA,NA,NA,NA,NA,NA,NA,NA
1125,69799991,Centre francophone du Grand TO - Centre francophone du Grand TO,CFGT,Francophone Centre of Toronto,French Community Centre,Test de français international,TFI,Toronto Francophone Centre,NA,NA,NA,NA,NA,NA,NA,NA,NA,NA,NA,NA,NA,NA,NA,NA,NA,NA,NA
1126,70808172,Centro Abruzzo / Villa Charities - Italian Canadian Benevolent Corporation,NA,NA,NA,NA,NA,NA,NA,NA,NA,NA,NA,NA,NA,NA,NA,NA,NA,NA,NA,NA,NA,NA,NA,NA,NA
1127,70809090,Centro Clinton Day Care Centre - Centro Clinton Day Care Centre,NA,NA,NA,NA,NA,NA,NA,NA,NA,NA,NA,NA,NA,NA,NA,NA,NA,NA,NA,NA,NA,NA,NA,NA,NA
1128,69794487,CESO - CESO,NA,NA,NA,NA,NA,NA,NA,NA,NA,NA,NA,NA,NA,NA,NA,NA,NA,NA,NA,NA,NA,NA,NA,NA,NA
1129,70917128,Chabad Lubavitch Of York Mills - Chabad Lubavitch Of York Mills,NA,NA,NA,NA,NA,NA,NA,NA,NA,NA,NA,NA,NA,NA,NA,NA,NA,NA,NA,NA,NA,NA,NA,NA,NA
1130,70808034,"Chabad Of Midtown - Chabad Of Midtown, Bathurst St",NA,NA,NA,NA,NA,NA,NA,NA,NA,NA,NA,NA,NA,NA,NA,NA,NA,NA,NA,NA,NA,NA,NA,NA,NA
1131,70808037,"Chabad Of Midtown - Chabad Of Midtown, St Clair",NA,NA,NA,NA,NA,NA,NA,NA,NA,NA,NA,NA,NA,NA,NA,NA,NA,NA,NA,NA,NA,NA,NA,NA,NA
1132,70809219,Champions Children's Centre - Champions Children's Centre,NA,NA,NA,NA,NA,NA,NA,NA,NA,NA,NA,NA,NA,NA,NA,NA,NA,NA,NA,NA,NA,NA,NA,NA,NA
1133,70810899,Charlottetown Blvd Childcare Centre - Charlottetown Blvd Childcare Centre,NA,NA,NA,NA,NA,NA,NA,NA,NA,NA,NA,NA,NA,NA,NA,NA,NA,NA,NA,NA,NA,NA,NA,NA,NA
1134,70808938,Charlottetown Kindergarten Extended Care Program - Charlottetown Kindergarten Extended Care Program,NA,NA,NA,NA,NA,NA,NA,NA,NA,NA,NA,NA,NA,NA,NA,NA,NA,NA,NA,NA,NA,NA,NA,NA,NA
1135,69838141,Chartered Professional Accountants of ON - Chartered Professional Accountants of ON,CAO,Chartered Accountants of Ontario,CPA Ontario,ICAO,Ontario Institute of Chartered Accountants,NA,NA,NA,NA,NA,NA,NA,NA,NA,NA,NA,NA,NA,NA,NA,NA,NA,NA,NA,NA
1136,70810903,Chartland Child Care - Chartland Child Care,NA,NA,NA,NA,NA,NA,NA,NA,NA,NA,NA,NA,NA,NA,NA,NA,NA,NA,NA,NA,NA,NA,NA,NA,NA
1137,71086254,Chartwell Avondale Retirement Residence - Chartwell Avondale Retirement Residence,NA,NA,NA,NA,NA,NA,NA,NA,NA,NA,NA,NA,NA,NA,NA,NA,NA,NA,NA,NA,NA,NA,NA,NA,NA
1138,73440881,Chartwell Gibson Long Term Care Residence - Chartwell Gibson Long Term Care Residence,Gibson Long Term Care Home,NA,NA,NA,NA,NA,NA,NA,NA,NA,NA,NA,NA,NA,NA,NA,NA,NA,NA,NA,NA,NA,NA,NA,NA
1139,73025071,Chartwell Gibson Retirement Residence - Chartwell Gibson Retirement Residence,NA,NA,NA,NA,NA,NA,NA,NA,NA,NA,NA,NA,NA,NA,NA,NA,NA,NA,NA,NA,NA,NA,NA,NA,NA
1140,73025069,Chartwell Gibson Retirement Residence - Respite Care,NA,NA,NA,NA,NA,NA,NA,NA,NA,NA,NA,NA,NA,NA,NA,NA,NA,NA,NA,NA,NA,NA,NA,NA,NA
1141,71085762,Chartwell Grenadier Retirement Residence (The) - Chartwell Grenadier Retirement Residence (The),"Diversicare Canadian Management Services Co., Inc.",NA,NA,NA,NA,NA,NA,NA,NA,NA,NA,NA,NA,NA,NA,NA,NA,NA,NA,NA,NA,NA,NA,NA,NA
1142,73025079,Chartwell Lansing Retirement Residence - Chartwell Lansing Retirement Residence,NA,NA,NA,NA,NA,NA,NA,NA,NA,NA,NA,NA,NA,NA,NA,NA,NA,NA,NA,NA,NA,NA,NA,NA,NA
1143,73451226,Chartwell Retirement Residence - Scarlett Heights - Chartwell Retirement Residence - Scarlett Heights,NA,NA,NA,NA,NA,NA,NA,NA,NA,NA,NA,NA,NA,NA,NA,NA,NA,NA,NA,NA,NA,NA,NA,NA,NA
1144,73451163,Chartwell White Eagle Long Term Care Residence - Chartwell White Eagle Long Term Care Residence,NA,NA,NA,NA,NA,NA,NA,NA,NA,NA,NA,NA,NA,NA,NA,NA,NA,NA,NA,NA,NA,NA,NA,NA,NA
1145,73441235,CHATS - Community and Home Assistance to Seniors - Arirang Korean Adult Day Program,CHATS Adult Day Program,NA,NA,NA,NA,NA,NA,NA,NA,NA,NA,NA,NA,NA,NA,NA,NA,NA,NA,NA,NA,NA,NA,NA,NA
1146,70810907,Cheer Day Care Centre - Cheer Day Care Centre,NA,NA,NA,NA,NA,NA,NA,NA,NA,NA,NA,NA,NA,NA,NA,NA,NA,NA,NA,NA,NA,NA,NA,NA,NA
1147,73440960,Cheltenham Care Community - Cheltenham Care Community,NA,NA,NA,NA,NA,NA,NA,NA,NA,NA,NA,NA,NA,NA,NA,NA,NA,NA,NA,NA,NA,NA,NA,NA,NA
1148,70807883,Chester Le Early Learning and Child Care Centre - Chester Le Early Learning and Child Care Centre,NA,NA,NA,NA,NA,NA,NA,NA,NA,NA,NA,NA,NA,NA,NA,NA,NA,NA,NA,NA,NA,NA,NA,NA,NA
1149,73451088,Chester Village - Chester Village,NA,NA,NA,NA,NA,NA,NA,NA,NA,NA,NA,NA,NA,NA,NA,NA,NA,NA,NA,NA,NA,NA,NA,NA,NA
1150,65304156,Chiefs of ON - Admin.,COO,NA,NA,NA,NA,NA,NA,NA,NA,NA,NA,NA,NA,NA,NA,NA,NA,NA,NA,NA,NA,NA,NA,NA,NA
1151,70810573,"Child Development Institute [Child care] - Child Development Institute [Child care], Annex Early Learning Centre",NA,NA,NA,NA,NA,NA,NA,NA,NA,NA,NA,NA,NA,NA,NA,NA,NA,NA,NA,NA,NA,NA,NA,NA,NA
1152,70810570,"Child Development Institute [Child care] - Child Development Institute [Child care], Fraser Mustard Early Learning Centre",NA,NA,NA,NA,NA,NA,NA,NA,NA,NA,NA,NA,NA,NA,NA,NA,NA,NA,NA,NA,NA,NA,NA,NA,NA
1153,70810576,"Child Development Institute [Child care] - Child Development Institute [Child care], Parkdale Early Learning Centre",NA,NA,NA,NA,NA,NA,NA,NA,NA,NA,NA,NA,NA,NA,NA,NA,NA,NA,NA,NA,NA,NA,NA,NA,NA
1154,70810567,"Child Development Institute [Child care] - Child Development Institute [Child care], Wellesley Early Learning Centre",NA,NA,NA,NA,NA,NA,NA,NA,NA,NA,NA,NA,NA,NA,NA,NA,NA,NA,NA,NA,NA,NA,NA,NA,NA
1155,73450984,Childhood Cancer Canada - Childhood Cancer Canada,Candlelighters Canada,Childhood Cancer Canada Foundation,Childhood Cancer Foundation,NA,NA,NA,NA,NA,NA,NA,NA,NA,NA,NA,NA,NA,NA,NA,NA,NA,NA,NA,NA,NA,NA
1156,70809231,Children Are People Education - Children Are People Education,NA,NA,NA,NA,NA,NA,NA,NA,NA,NA,NA,NA,NA,NA,NA,NA,NA,NA,NA,NA,NA,NA,NA,NA,NA
